{
  "id": "AU-2025-26",
  "country": "AU",
  "name": "Australia 2025–26",
  "currency": "AUD",
  "from": "2025-07-01",
  "to": "2026-06-30",
  "source": "https://www.ato.gov.au/tax-rates-and-codes/tax-rates-australian-residents",
  "sources": [
    "https://www.ato.gov.au/tax-rates-and-codes/tax-rates-australian-residents",
    "https://www.ato.gov.au/individuals-and-families/medicare-and-private-health-insurance/medicare-levy/medicare-levy-reduction/medicare-levy-reduction-for-low-income-earners",
    "https://www.ato.gov.au/individuals-and-families/income-deductions-offsets-and-records/tax-offsets/low-and-middle-income-earner-tax-offsets",
    "https://www.ato.gov.au/tax-rates-and-codes/study-and-training-support-loans-rates-and-repayment-thresholds"
  ],
  "verifiedAt": "2026-09-27",
  "verified": true,
  "notes": [
    "Resident individual, full year. Taxable income is gross minus deductions the user enters.",
    "Medicare levy surcharge, family thresholds and SAPTO are not modelled."
  ],
  "brackets": [
    {
      "over": "0",
      "rate": "0"
    },
    {
      "over": "18200",
      "rate": "0.16"
    },
    {
      "over": "45000",
      "rate": "0.30"
    },
    {
      "over": "135000",
      "rate": "0.37"
    },
    {
      "over": "190000",
      "rate": "0.45"
    }
  ],
  "offsets": [
    {
      "name": "Low income tax offset",
      "points": [
        {
          "income": "0",
          "amount": "700"
        },
        {
          "income": "37500",
          "amount": "700"
        },
        {
          "income": "45000",
          "amount": "325"
        },
        {
          "income": "66667",
          "amount": "0"
        }
      ]
    }
  ],
  "levies": [
    {
      "name": "Medicare levy",
      "base": "taxable",
      "bands": [
        {
          "over": "0",
          "rate": "0.02"
        }
      ],
      "exemptAtOrBelow": "28011",
      "shadeInRate": "0.10",
      "note": "Single, not entitled to SAPTO: nil at or below the lower threshold, then 10c per $1 above it until 2% applies"
    }
  ],
  "studentLoans": [
    {
      "name": "HELP",
      "bands": [
        {
          "over": "0",
          "rate": "0"
        },
        {
          "over": "67000",
          "rate": "0.15"
        },
        {
          "over": "125000",
          "rate": "0.17",
          "baseAmount": "8700"
        },
        {
          "over": "179285",
          "rate": "0.10",
          "appliesTo": "total"
        }
      ],
      "note": "Marginal repayment on repayment income from 2025–26"
    }
  ],
  "samples": [
    {
      "gross": "29000",
      "incomeTax": "1028.00",
      "levies": "98.90",
      "socialContributions": "0.00",
      "net": "27873.10",
      "checkedWith": "ATO Medicare levy example: levy $98.90 at $29,000 (2025–26)"
    },
    {
      "gross": "45000",
      "incomeTax": "3963.00",
      "levies": "900.00",
      "socialContributions": "0.00",
      "net": "40137.00",
      "checkedWith": "tax_reference.py from the published rates"
    },
    {
      "gross": "90000",
      "incomeTax": "17788.00",
      "levies": "1800.00",
      "socialContributions": "0.00",
      "net": "70412.00",
      "checkedWith": "tax_reference.py from the published rates"
    },
    {
      "gross": "200000",
      "incomeTax": "56138.00",
      "levies": "4000.00",
      "socialContributions": "0.00",
      "net": "139862.00",
      "checkedWith": "tax_reference.py from the published rates"
    }
  ],
  "studentLoanSamples": [
    {
      "plan": "HELP",
      "income": "90000",
      "repayment": "3450.00",
      "checkedWith": "tax_reference.py from the published rates"
    },
    {
      "plan": "HELP",
      "income": "150000",
      "repayment": "12950.00",
      "checkedWith": "tax_reference.py from the published rates"
    },
    {
      "plan": "HELP",
      "income": "200000",
      "repayment": "20000.00",
      "checkedWith": "tax_reference.py from the published rates"
    }
  ]
}
