{
  "id": "GB-2026-27",
  "country": "GB",
  "name": "United Kingdom 2026–27 (England, Wales and Northern Ireland)",
  "variant": "rUK",
  "isDefault": true,
  "currency": "GBP",
  "from": "2026-04-06",
  "to": "2027-04-05",
  "source": "https://www.gov.uk/income-tax-rates",
  "sources": [
    "https://www.gov.uk/income-tax-rates",
    "https://www.gov.uk/guidance/rates-and-thresholds-for-employers-2026-to-2027"
  ],
  "verifiedAt": "2026-09-27",
  "verified": true,
  "notes": [
    "Employee with a standard Personal Allowance (tax code 1257L). Brackets apply to income after the allowance, which tapers by £1 for every £2 over £100,000.",
    "Dividend and savings rates aren't modelled."
  ],
  "deductions": [
    {
      "name": "Personal Allowance",
      "amount": "12570",
      "taperStart": "100000",
      "taperRate": "0.5"
    }
  ],
  "brackets": [
    {
      "over": "0",
      "rate": "0.20"
    },
    {
      "over": "37700",
      "rate": "0.40"
    },
    {
      "over": "125140",
      "rate": "0.45"
    }
  ],
  "socialContributions": [
    {
      "name": "National Insurance (Class 1, category A)",
      "base": "gross",
      "bands": [
        {
          "over": "0",
          "rate": "0"
        },
        {
          "over": "12570",
          "rate": "0.08"
        },
        {
          "over": "50270",
          "rate": "0.02"
        }
      ]
    }
  ],
  "studentLoans": [
    {
      "name": "Plan 1",
      "bands": [
        {
          "over": "0",
          "rate": "0"
        },
        {
          "over": "26900",
          "rate": "0.09"
        }
      ]
    },
    {
      "name": "Plan 2",
      "bands": [
        {
          "over": "0",
          "rate": "0"
        },
        {
          "over": "29385",
          "rate": "0.09"
        }
      ]
    },
    {
      "name": "Plan 4",
      "bands": [
        {
          "over": "0",
          "rate": "0"
        },
        {
          "over": "33795",
          "rate": "0.09"
        }
      ]
    },
    {
      "name": "Plan 5",
      "bands": [
        {
          "over": "0",
          "rate": "0"
        },
        {
          "over": "25000",
          "rate": "0.09"
        }
      ]
    },
    {
      "name": "Postgraduate loan",
      "bands": [
        {
          "over": "0",
          "rate": "0"
        },
        {
          "over": "21000",
          "rate": "0.06"
        }
      ]
    }
  ],
  "samples": [
    {
      "gross": "30000",
      "incomeTax": "3486.00",
      "levies": "0.00",
      "socialContributions": "1394.40",
      "net": "25119.60",
      "checkedWith": "tax_reference.py from the published rates"
    },
    {
      "gross": "60000",
      "incomeTax": "11432.00",
      "levies": "0.00",
      "socialContributions": "3210.60",
      "net": "45357.40",
      "checkedWith": "tax_reference.py from the published rates"
    },
    {
      "gross": "110000",
      "incomeTax": "33432.00",
      "levies": "0.00",
      "socialContributions": "4210.60",
      "net": "72357.40",
      "checkedWith": "tax_reference.py from the published rates"
    },
    {
      "gross": "150000",
      "incomeTax": "53703.00",
      "levies": "0.00",
      "socialContributions": "5010.60",
      "net": "91286.40",
      "checkedWith": "tax_reference.py from the published rates"
    }
  ],
  "studentLoanSamples": [
    {
      "plan": "Plan 2",
      "income": "40000",
      "repayment": "955.35",
      "checkedWith": "tax_reference.py from the published rates"
    },
    {
      "plan": "Plan 1",
      "income": "30000",
      "repayment": "279.00",
      "checkedWith": "tax_reference.py from the published rates"
    },
    {
      "plan": "Postgraduate loan",
      "income": "40000",
      "repayment": "1140.00",
      "checkedWith": "tax_reference.py from the published rates"
    }
  ]
}
